{
  "$id": "https://harnessy.dev/schemas/library-components.schema.json",
  "$schema": "https://json-schema.org/draft/2020-12/schema",
  "type": "object",
  "properties": {
    "id": {
      "type": "string",
      "pattern": "^[a-z0-9][a-z0-9-]*$"
    },
    "name": {
      "type": "string"
    },
    "connectors": {
      "type": "array",
      "items": {
        "type": "object",
        "properties": {
          "designator": {
            "type": "string",
            "pattern": "^[A-Za-z0-9_-]+$"
          },
          "connector": {
            "type": "string",
            "pattern": "^(connectors)\\/[a-z0-9][a-z0-9-]*$"
          },
          "label": {
            "type": "string"
          },
          "side": {
            "type": "string",
            "enum": [
              "left",
              "right",
              "top",
              "bottom"
            ]
          }
        },
        "required": [
          "designator",
          "connector"
        ]
      }
    },
    "bridges": {
      "type": "array",
      "items": {
        "type": "array",
        "items": {
          "type": "string",
          "pattern": "^[A-Za-z0-9_-]+$"
        }
      }
    },
    "part_number": {
      "type": "string"
    },
    "manufacturer": {
      "type": "string"
    }
  },
  "required": [
    "id",
    "name",
    "connectors"
  ]
}
