{
  "id": "inline-switch-fuse",
  "name": "In-line switch and fuse",
  "connectors": [
    {
      "designator": "IN",
      "connector": "connectors/xt90",
      "side": "left"
    },
    {
      "designator": "OUT",
      "connector": "connectors/xt90",
      "side": "right"
    }
  ],
  "bridges": [
    [
      "IN",
      "OUT"
    ]
  ],
  "part_number": "TBD"
}
