{
  "id": "roboclaw-60v",
  "name": "RoboClaw 60 V dual motor controller",
  "connectors": [
    {
      "designator": "PWR",
      "connector": "connectors/screw-term-2",
      "label": "48 V in",
      "side": "left"
    },
    {
      "designator": "M1",
      "connector": "connectors/screw-term-2",
      "side": "right"
    },
    {
      "designator": "M2",
      "connector": "connectors/screw-term-2",
      "side": "right"
    },
    {
      "designator": "ENC1",
      "connector": "connectors/pin-header-254-6",
      "side": "right"
    },
    {
      "designator": "ENC2",
      "connector": "connectors/pin-header-254-6",
      "side": "right"
    },
    {
      "designator": "CAN-A",
      "connector": "connectors/jst-gh-4",
      "side": "left"
    },
    {
      "designator": "CAN-B",
      "connector": "connectors/jst-gh-4",
      "side": "left"
    }
  ],
  "bridges": [
    [
      "CAN-A",
      "CAN-B"
    ]
  ],
  "part_number": "TBD",
  "manufacturer": "Basicmicro"
}
