{
  "id": "bus-bar-48v",
  "name": "48 V bus bar",
  "connectors": [
    {
      "designator": "BAT",
      "connector": "connectors/busbar-m6-pair",
      "label": "battery feed",
      "side": "left"
    },
    {
      "designator": "L1",
      "connector": "connectors/busbar-m6-pair",
      "label": "load",
      "side": "right"
    },
    {
      "designator": "L2",
      "connector": "connectors/busbar-m6-pair",
      "label": "load",
      "side": "right"
    },
    {
      "designator": "L3",
      "connector": "connectors/busbar-m6-pair",
      "label": "load",
      "side": "right"
    },
    {
      "designator": "L4",
      "connector": "connectors/busbar-m6-pair",
      "label": "load",
      "side": "right"
    },
    {
      "designator": "L5",
      "connector": "connectors/busbar-m6-pair",
      "label": "load",
      "side": "right"
    },
    {
      "designator": "L6",
      "connector": "connectors/busbar-m6-pair",
      "label": "load",
      "side": "right"
    },
    {
      "designator": "L7",
      "connector": "connectors/busbar-m6-pair",
      "label": "load",
      "side": "right"
    },
    {
      "designator": "L8",
      "connector": "connectors/busbar-m6-pair",
      "label": "load",
      "side": "right"
    },
    {
      "designator": "L9",
      "connector": "connectors/busbar-m6-pair",
      "label": "load",
      "side": "right"
    },
    {
      "designator": "L10",
      "connector": "connectors/busbar-m6-pair",
      "label": "load",
      "side": "right"
    }
  ],
  "bridges": [
    [
      "BAT",
      "L1",
      "L2",
      "L3",
      "L4",
      "L5",
      "L6",
      "L7",
      "L8",
      "L9",
      "L10"
    ]
  ],
  "part_number": "TBD"
}
