{
  "id": "usb-hub-powered",
  "name": "USB hub, powered, 4 port",
  "connectors": [
    {
      "designator": "UP",
      "connector": "connectors/usb-c",
      "label": "upstream",
      "side": "left"
    },
    {
      "designator": "D1",
      "connector": "connectors/usb-a",
      "side": "right"
    },
    {
      "designator": "D2",
      "connector": "connectors/usb-a",
      "side": "right"
    },
    {
      "designator": "D3",
      "connector": "connectors/usb-a",
      "side": "right"
    },
    {
      "designator": "D4",
      "connector": "connectors/usb-a",
      "side": "right"
    },
    {
      "designator": "PWR",
      "connector": "connectors/dc-barrel-5521",
      "label": "24 V in",
      "side": "left"
    }
  ],
  "part_number": "TBD"
}
